title,domain,description,stipend,location
Accounts Payable Intern,Accounts,Process vendor invoices and manage accounts payable transactions. Assist in month-end closing procedures and financial reconciliation activities. Learn about accounting software and help maintain accurate financial records.,"₹6,000 - ₹11,000",Kolkata
Tax Advisory Intern,Accounts,Support tax preparation and compliance activities for individual and corporate clients. Learn about tax regulations and assist in tax planning strategies. Help prepare tax returns and maintain client documentation.,"₹8,000 - ₹14,000",Mumbai
Financial Analyst Intern,Accounts,Analyze financial statements and prepare variance analysis reports for management review. Support budget preparation and forecasting activities. Assist in financial modeling and investment analysis for capital expenditure decisions.,"₹9,000 - ₹16,000",Mumbai
Cost Accounting Intern,Accounts,Calculate product costing and analyze manufacturing overhead allocations. Support standard costing procedures and variance analysis. Assist in inventory valuation and cost control initiatives for production departments.,"₹7,000 - ₹13,000",Chennai
Audit Intern,Accounts,Support external audit procedures including financial statement review and compliance testing. Assist in internal audit activities and control testing procedures. Learn about audit documentation and regulatory reporting requirements.,"₹8,000 - ₹15,000",Delhi
Treasury Management Intern,Accounts,Support cash flow management and foreign exchange hedging activities. Assist in bank relationship management and investment portfolio monitoring. Learn about interest rate risk management and liquidity planning.,"₹10,000 - ₹17,000",Mumbai
Management Accounting Intern,Accounts,Prepare management reports and performance dashboards for business units. Support profitability analysis and cost center reporting. Assist in transfer pricing documentation and intercompany reconciliation activities.,"₹8,000 - ₹14,000",Bangalore
