title,domain,description,stipend,location
Renewable Energy Intern,Energy & Sustainability,Support renewable energy project development and feasibility studies. Assist in solar and wind energy system design and installation planning. Learn about energy storage technologies and grid integration challenges.,"₹9,000 - ₹15,000",Ahmedabad
Sustainability Consulting Intern,Energy & Sustainability,Help organizations develop and implement sustainability strategies and environmental impact assessments. Assist in carbon footprint analysis and sustainable supply chain initiatives. Learn about ESG reporting and green certification processes.,"₹10,000 - ₹16,000",Mumbai
Solar Energy Intern,Energy & Sustainability,Support solar panel installation projects and system performance monitoring. Assist in solar energy feasibility studies and financial modeling. Learn about grid-tied systems and energy storage integration.,"₹8,000 - ₹15,000",Rajkot
Wind Energy Intern,Energy & Sustainability,Support wind farm development projects including site assessment and environmental impact studies. Assist in wind turbine maintenance scheduling and performance optimization. Learn about wind resource analysis and grid integration.,"₹9,000 - ₹16,000",Chennai
Energy Efficiency Intern,Energy & Sustainability,Conduct energy audits for commercial and industrial facilities to identify conservation opportunities. Support implementation of energy management systems and green building certifications. Assist in carbon footprint analysis and reporting.,"₹8,000 - ₹14,000",Pune
Environmental Compliance Intern,Energy & Sustainability,Monitor environmental regulations and support compliance reporting for manufacturing facilities. Assist in waste management programs and pollution control initiatives. Learn about environmental impact assessments and permitting processes.,"₹7,000 - ₹13,000",Mumbai
Carbon Trading Intern,Energy & Sustainability,Support carbon offset project development and verification activities. Assist in emissions trading and carbon credit management. Learn about climate change mitigation strategies and international carbon markets.,"₹10,000 - ₹17,000",Delhi
